<?xml version="1.0" encoding="UTF-8" ?>

<!DOCTYPE ListaCompras SYSTEM "ListaCompras.dtd">

<ListaCompras xmlns:xsi="http://www.w3.org/2001/XMLSchema-instance"
              xsi:noNamespaceSchemaLocation="ListaCompras.xsd">
    <Venta>
        <VentaCredito>
            <FechaFinPago></FechaFinPago>
            <CantidadCredito></CantidadCredito>
        </VentaCredito>
    </Venta>
    <Venta>
        <VentaInmediata>
            <Cantidad></Cantidad>
            <Divisa></Divisa>
        </VentaInmediata>
    </Venta>
    <Venta>
        <VentaInmediata>
            <Cantidad></Cantidad>
            <Divisa></Divisa>
        </VentaInmediata>
    </Venta>
    <Venta>
        <VentaInmediata>
            <Cantidad></Cantidad>
            <Divisa></Divisa>
        </VentaInmediata>
    </Venta>
</ListaCompras>